<?xml version="1.0" ?>
<Game xmlns:xsi="http://www.w3.org/2001/XMLSchema-instance"
  xmlns:xsd="http://www.w3.org/2001/XmlSchema"
  xsi:schemaLocation="urn:GameData GameData.xsd">
  <Rooms>
    <Room LongDescription="You are in a big cavern. There are passages leading to the north and east." Id="1">
      <Passages>
        <Passage Direction="North" Destination="2" />
        <Passage Direction="East" Destination="3" />
      </Passages>
    </Room>
    <Room LongDescription="You are in a small cave with water dripping from the ceiling. There is a passage leading south and a difficult crawl down a pit." Id="2">
      <Passages>
        <Passage Direction="South" Destination="1" />
        <Passage Direction="Down" Destination="5" />
      </Passages>
    </Room>
    <Room LongDescription="You are in a long hallway stretching to the east and west." Id="3" >
      <Passages>
        <Passage Direction="West" Destination="1" />
        <Passage Direction="East" Destination="4" />
      </Passages>
    </Room>
    <Room LongDescription="You are in a beautifully carved chamber whose walls are solid marble. There is an exit to the west." Id="4" >
      <Passages>
        <Passage Direction="West" Destination="3" />
      </Passages>
    </Room>
    <Room LongDescription="You are at the bottom of a damp pit. The only way out is up." Id="5" >
      <Passages>
        <Passage Direction="Up" Destination="2" />
      </Passages>
    </Room>
  </Rooms>
</Game>